{
  "schema": "cyclotron-status/v1",
  "cyclotron": {
    "id": "papyrus-relevance",
    "classifier": "relevant",
    "version": 13,
    "refits": 0,
    "fingerprint": "5f1c0e7a"
  },
  "asOf": "2026-10-09T14:00:00+00:00",
  "alignment": {
    "window": 200,
    "labels": 184,
    "accuracy": 0.86,
    "precision": 0.81,
    "recall": 0.9,
    "positiveLabel": "include",
    "measuredOn": "reviews selected by the cyclotron"
  },
  "calibration": {
    "saysSure": 0.84,
    "isRight": 0.86,
    "gapPoints": 2,
    "curve": [
      {
        "bin": 0.8,
        "count": 41,
        "confidence": 0.84,
        "accuracy": 0.83
      }
    ]
  },
  "reviewRate": {
    "state": "tapering",
    "rate": 0.25,
    "reason": "Stepped down to 25%: accuracy on confident decisions 88% met the 85% target and the calibration gap was 2 points for 2 windows in a row.",
    "auditFloor": 0.05,
    "confidenceThreshold": 0.7,
    "override": null,
    "expectedReviewsPerWeek": 12,
    "nextCheckAfterDecisions": 40,
    "nextStep": "Steps down to 10% after 2 more windows of 100 decisions with accuracy on confident decisions of at least 85% (at least 20 reviewed) and a calibration gap under 5 points. Next check in 40 decisions.",
    "plainReason": "Suggestions have been reliable, so about 25% of confident ones need a review.",
    "plainNextStep": "Fewer suggestions will need review if they stay reliable."
  },
  "lastChange": {
    "kind": "promoted",
    "fromVersion": 12,
    "toVersion": 13,
    "at": "2026-10-08T09:12:00+00:00",
    "summary": "Added question: is this vendor marketing?",
    "labels": null,
    "plainSummary": "Suggestions were updated."
  },
  "pending": {
    "decisionsAwaitingReview": 7,
    "staleSince": null
  }
}
